{
  "$schema": "https://json-schema.org/draft/2020-12/schema",
  "title": "Review completion signal v1.2.0",
  "description": "Written once by a native reviewer session to <run>/<node>.completion.json, where <node> is `review` for the default reviewer and `review-<reviewer_id>` for a reviewer declared in feature.json 2.1.0. The controller accepts it only when it validates here, its bindings match the run (run_id, that reviewer's node id, the launch_token from that reviewer's prompt, bundle SHA-256 and candidate commit from review-bundle.json) and the reviewer session is idle or done; a file whose node_id names another reviewer is rejected. Every declared reviewer must approve: a verdict of blocked, or any P0/P1 finding that is not resolved, from any reviewer ends the run and no reviewer is relaunched. 1.2.0: node_id follows `^review(-[a-z0-9-]{1,32})?$`. 1.1.0: a finding's `worker` is a lane id of the run (`^[a-z][a-z0-9-]{0,31}$`), `multiple` or `none`; the controller additionally rejects a lane id the run did not select. The legacy `both` is not accepted any more. Files spelling version 1.0.0 or 1.1.0 are still accepted under the same rules.",
  "type": "object",
  "additionalProperties": false,
  "required": [
    "version",
    "run_id",
    "node_id",
    "launch_token",
    "bundle_sha256",
    "candidate_commit",
    "verdict",
    "findings"
  ],
  "properties": {
    "version": {
      "enum": [
        "1.0.0",
        "1.1.0",
        "1.2.0"
      ]
    },
    "run_id": {
      "type": "string",
      "pattern": "^[A-Za-z0-9][A-Za-z0-9._-]{0,127}$"
    },
    "node_id": {
      "type": "string",
      "pattern": "^review(-[a-z0-9-]{1,32})?$",
      "description": "`review` for the default reviewer, `review-<reviewer_id>` for a declared reviewer; the controller binds it to the reviewer the prompt named."
    },
    "launch_token": {
      "type": "string",
      "pattern": "^[0-9a-f]{8}-[0-9a-f]{4}-[0-9a-f]{4}-[0-9a-f]{4}-[0-9a-f]{12}$"
    },
    "bundle_sha256": {
      "type": "string",
      "pattern": "^[a-f0-9]{64}$"
    },
    "candidate_commit": {
      "type": "string",
      "pattern": "^[a-f0-9]{40}$"
    },
    "verdict": {
      "enum": [
        "approved",
        "blocked"
      ]
    },
    "findings": {
      "type": "array",
      "items": {
        "type": "object",
        "additionalProperties": false,
        "required": [
          "severity",
          "message",
          "disposition",
          "worker",
          "requirement"
        ],
        "properties": {
          "severity": {
            "enum": [
              "P0",
              "P1",
              "P2"
            ]
          },
          "message": {
            "type": "string",
            "minLength": 1
          },
          "disposition": {
            "enum": [
              "open",
              "resolved",
              "accepted"
            ]
          },
          "worker": {
            "description": "The lane whose assignment the finding concerns (one of the run's selected lane ids), `multiple` when it concerns several lanes, or `none` for cross-cutting/policy findings. Never `both` and never a fixed graph node name.",
            "type": "string",
            "pattern": "^(?!(?:review|candidate|handoff|approval|integrate|both|challenge|sidecar)$)(?!(?:launch_|verify_|candidate_|review-|challenge-|sidecar-))[a-z][a-z0-9-]{0,31}$"
          },
          "requirement": {
            "description": "A verbatim quote from that lane's task text that the finding relates to, or null when no single requirement applies. Consumers link a finding to its task only when the quote is found verbatim; nothing is inferred.",
            "type": [
              "string",
              "null"
            ],
            "minLength": 1
          }
        }
      }
    }
  }
}
