{"version":"1.2.0","run_id":"veashi-vea-addresses-002","node_id":"review-general","launch_token":"eb01d2cf-6255-4245-93d5-c9509d787bd7","bundle_sha256":"fdbaed0936c0d63debcb4f59a860333d14e2554e2f2e6bfcef51a90c030fbe3f","candidate_commit":"e1caed7ed4f2d8f0ffb480c0a79aef6ad76fad65","verdict":"blocked","findings":[{"severity":"P1","message":"Required independent review could not be performed: available tools provide no local text-file reader or filesystem resources, and command execution is expressly prohibited. The diff, bundle, candidate files, verification packets, check sources and plan.json task requirements remain unread. Approval is therefore unsupported. This is a review-evidence blocker, not an identified implementation defect; provide the materials directly or enable a read-only file tool.","disposition":"open","worker":"none","requirement":null}]}