{"version": "1.2.0", "run_id": "intel-core-001", "node_id": "review-coverage", "launch_token": "910b4f8e-fe8c-401c-9003-57358a0c5faf", "bundle_sha256": "61e79d48fb01b9f72f31ecfbbd4b05eaea5077b8e51ca93ab05e3d99fffda2fb", "candidate_commit": "b62a41b5096d0b2f904ddca96c7ae7eb5dbd47a7", "verdict": "approved", "findings": [{"severity": "P2", "message": "No test bounds the number of pending deferred sightings. intel.test.ts only asserts single-entry pending arrays (lines 233, 346), and property.test.ts:334 only records that some pending entry existed (EXERCISED 'sighting:deferred') without checking a bound or that it was delivered. The implementation (step.ts:344) keeps one pending entry per type, not per player, so a test of the per-player bound would not pass as written. Whether that deviation is acceptable is for the general reviewer; as it stands, the bound is untested.", "disposition": "open", "worker": "intel", "requirement": "it is delivered at the next snapshot boundary (at most one pending per player)"}, {"severity": "P2", "message": "No test enforces that carrier sightings come only from the three listed triggers. The property Checker (property.test.ts:405-424) accepts a carrier-sighting with any reason, and the scripted test intel.test.ts:175 asserts a sighting with reason 'start', which is a fourth trigger. The cap and age rules are tested, but this restriction has no test, and the suite asserts the opposite case.", "disposition": "open", "worker": "intel", "requirement": "It is sent only on three triggers: a fresh rumor after a loss when every other copy is carried, a targeted rumor under the same condition, or a journal replacement when every remaining copy is carried."}]}
